book_id,book_title,author,publication_year,cover_image_filename,short_summary,full_summary,target_audience,estimated_read_time_hours,primary_category,secondary_categories,skill_tags,leadership_competencies,technical_skills,soft_skills,behavioral_outcomes,key_concepts,key_frameworks_models,case_studies_examples,practical_exercises,recommended_for_roles,prerequisite_knowledge,difficulty_level,cpd_hours_value,learning_objectives,actionable_takeaways,best_for_scenarios,related_books,quotes,isbn,amazon_link,goodreads_rating
001,Traction: Get a Grip on Your Business,Gino Wickman,2012,001_traction_wickman.jpg,"Introduces the Entrepreneurial Operating System (EOS), a practical way to run and scale a small–mid business. Focuses on clarity, accountability, and execution.","Problem: entrepreneurial chaos and inconsistent results. Approach: implement EOS across Vision, People, Data, Issues, Process, Traction; build an operating rhythm with scorecards and meetings. Themes: focus, discipline, right people/right seats, measurables, solving issues at root. Audience: founders, leaders of SMEs, integrators. Unique value: a complete, tool-driven operating system with step-by-step roll-out.",All Levels,10,Business Strategy,Leadership & Management|Decision Making|Change Management|Team Building,Operating rhythm design|Scorecard creation|OKR/rocks setting|Meeting facilitation|Issue solving|Process mapping|Accountability systems|KPI management|Org design|Leadership alignment|Execution discipline|Change adoption|Prioritisation|Decision making|Vendor/client management,Strategic thinking|Results orientation|People leadership|Change leadership|Decision quality|Communication|Coaching mindset|Accountability,Scorecard design|Process documentation|Quarterly planning|Level-10 meeting facilitation|KPI selection,Active listening|Empathy|Assertiveness|Constructive feedback|Stakeholder management|Facilitation|Collaboration|Adaptability|Time management|Self-awareness,"Leaders install a simple cadence, track measurables weekly, assign clear owners, and resolve issues decisively; teams gain focus and execution discipline.",Vision/Traction balance|Right People Right Seats|Rocks and scorecard|Level-10 meetings|Process documentation,"EOS model (Vision, People, Data, Issues, Process, Traction)|Accountability Chart|Rocks & Scorecard|IDS Issue Solving|Level-10 Meeting",YES: examples from growth-stage companies across services & manufacturing,YES,Partners|Directors|Managers|Team Members|New Advisors|All Levels,Basic business operations knowledge,Intermediate,15.0,Define the six EOS components|Build a basic accountability chart|Create a weekly scorecard|Set quarterly rocks|Run a Level-10 meeting|Use IDS to solve issues,Draft an accountability chart template|Launch a weekly L10 agenda|Choose 5–15 measurables|Set 3–7 rocks per quarter|Document one core process|Adopt the IDS sheet,Implementing an operating system|Scaling beyond the founder|Aligning leaders around KPIs|Fixing meeting sprawl|Turning strategy into execution,Rocket Fuel|What the Heck is EOS?|Get a Grip|Good to Great,"""Vision without traction is merely hallucination.""|""Simplify, delegate, elevate.""",,,4.2
002,Find Your Why,Simon Sinek; David Mead; Peter Docker,2017,002_find_your_why_sinek.jpg,A practical workbook to discover your personal or team WHY. Provides step‑by‑step exercises to articulate purpose and turn it into action.,"Problem: teams and individuals struggle to articulate purpose that guides decisions. Approach: structured discovery through stories, themes, and a Why statement; align Hows and Whats. Themes: meaning, trust, storytelling, facilitation. Audience: leaders, coaches, teams. Unique value: concrete workshop process that complements Start With Why.",All Levels,8,Strategic Thinking,Communication Skills|Leadership & Management|Coaching & Mentoring|Personal Development,Purpose articulation|Story elicitation|Facilitation|Values-to-behaviors translation|Vision communication|Motivation science|Goal alignment|Team chartering|Employer brand|Decision criteria design,Strategic thinking|Results orientation|People leadership|Change leadership|Decision quality|Communication|Coaching mindset|Accountability,Workshop design|Facilitated interviews|Theme analysis|Why statement drafting|Team charter creation,Active listening|Empathy|Assertiveness|Constructive feedback|Stakeholder management|Facilitation|Collaboration|Adaptability|Time management|Self-awareness,"Readers will run a WHY discovery session and craft a clear purpose statement used to guide goals, hiring, and messaging.",Why/How/What|Story themes lead to purpose|Translate values to behaviors|Peer-facilitation rules|Test and refine statements,Golden Circle (Why-How-What)|WHY Discovery Workshop steps|Hows as operating principles,YES: team and individual examples from diverse industries,YES,Partners|Directors|Managers|Team Members|New Advisors|All Levels,None,Beginner,12.0,Facilitate a WHY discovery|Synthesize stories into themes|Draft and test a Why statement|Define Hows as behaviors|Cascade Why to goals,Run the pair-interview exercise|Create a Why statement template|List 5–7 Hows|Map goals to Why|Add Why to job scorecards,Kick‑off a values project|Onboard new teams|Repositioning firm messaging|Career clarity conversations,Start With Why|Leaders Eat Last|The Culture Code|Atomic Habits,"""People don't buy what you do; they buy why you do it.""|""Your Why is the purpose, cause or belief that inspires you.""",,,4.1
003,Start With Why,Simon Sinek,2009,003_start_with_why_sinek.jpg,Explains why purpose-led leaders inspire deeper loyalty and performance. Shows how great organizations communicate from Why to build trust.,"Problem: many organizations push features not beliefs, producing weak engagement. Approach: illustrate the Golden Circle and trust-based leadership with case stories. Themes: purpose, trust, early adopters, clarity-consistency. Audience: leaders, marketers, founders. Unique value: a memorable mental model for purpose-driven strategy.",All Levels,8,Strategic Thinking,Leadership & Management|Communication Skills|Business Strategy,Purpose-led leadership|Vision communication|Brand positioning|Change storytelling|Customer centricity|Engagement drivers|Decision filters|Leadership credibility|Adoption curve|Mission clarity,Strategic thinking|Results orientation|People leadership|Change leadership|Decision quality|Communication|Coaching mindset|Accountability,Messaging hierarchy|Leadership narrative|Market positioning|Stakeholder alignment,Active listening|Empathy|Assertiveness|Constructive feedback|Stakeholder management|Facilitation|Collaboration|Adaptability|Time management|Self-awareness,"Leaders reframe strategies from purpose first, aligning messaging and decisions to a clear belief that rallies teams and clients.",Golden Circle|Clarity of Why|Consistency & discipline|Law of Diffusion of Innovation|Trust as competitive advantage,Golden Circle|Law of Diffusion of Innovation application,"YES: Apple, Southwest, etc.",NO,Partners|Directors|Managers|Team Members|New Advisors|All Levels,None,Beginner,12.0,Explain the Golden Circle|Audit current messaging for Why|Rewrite a value proposition from Why|Align initiatives to Why,Create a Why-first elevator pitch|Add Why to proposal templates|Design a trust-building comms cadence|Map initiatives to Why/How/What,Rebranding or positioning work|Culture refresh|Leadership offsites,Find Your Why|Leaders Eat Last|Good to Great|Give and Take,"""Start with WHY.""|""People follow leaders who lead.""",,,4.0
004,Leaders Eat Last,Simon Sinek,2014,004_leaders_eat_last_sinek.jpg,Argues that leaders must create a ‘Circle of Safety’ where trust and cooperation flourish. Uses biology and case stories to explain great cultures.,"Problem: toxic cultures trigger fear and short-termism. Approach: blend neuroscience and organizational examples to show how safety, belonging, and purpose drive performance. Themes: trust, hormones (oxytocin/cortisol), servant leadership, ethics. Audience: leaders of teams and firms. Unique value: translates human biology into practical culture choices.",All Levels,12,Leadership & Management,Team Building|Emotional Intelligence|Communication Skills,Culture building|Psychological safety|Servant leadership|Trust building|Ethical decision making|Wellbeing leadership|Communication cadence|Team norms|People-first policies|Retention levers,Strategic thinking|Results orientation|People leadership|Change leadership|Decision quality|Communication|Coaching mindset|Accountability,Team chartering|One-on-ones|Recognition systems|Safety rituals|Values-based decisions,Active listening|Empathy|Assertiveness|Constructive feedback|Stakeholder management|Facilitation|Collaboration|Adaptability|Time management|Self-awareness,"Leaders prioritize people over numbers, institutionalize trust rituals, and reduce fear-based management.",Circle of Safety| chemicals and behavior|Empathy-based leadership|Long-term vs short-term incentives|Trust rituals,Circle of Safety model|Leaders Eat Last behaviors,"YES: military, manufacturing, airlines",NO,Partners|Directors|Managers|Team Members|New Advisors|All Levels,Basic people leadership experience,Intermediate,18.0,Diagnose cultural safety|Design recognition rituals|Model servant leadership|Align incentives long-term|Run effective 1:1s,Schedule safety check-ins|Adopt peer-recognition|Remove perverse incentives|Coach managers on empathy micro-skills,Fixing low-trust teams|Post-merger integration|Rapid growth strain,The Culture Code|Radical Candor|The 7 Habits,"""So goes the leader, so goes the culture.""|""Leadership is not a rank; it’s a responsibility.""",,,4.2
005,The Culture Code,Daniel Coyle,2018,005_culture_code_coyle.jpg,"Distills secrets of successful groups into three skills: build safety, share vulnerability, and establish purpose.","Problem: teams often underperform despite talent. Approach: ethnographic research of elite teams to extract repeatable culture behaviors. Themes: belonging cues, candor, purpose phrasing. Audience: managers and team leaders. Unique value: concrete micro-behaviors and scripts to shape culture.",All Levels,10,Team Building,Leadership & Management|Communication Skills|Emotional Intelligence,Psychological safety|Feedback culture|Vulnerability-based trust|Purpose phrasing|Onboarding design|Rituals & norms|Team learning|Cadence setting|Hiring for fit|Coaching conversations,Strategic thinking|Results orientation|People leadership|Change leadership|Decision quality|Communication|Coaching mindset|Accountability,Onboarding design|Retrospectives|Feedback rituals|Team norms repository|Hiring rubrics,Active listening|Empathy|Assertiveness|Constructive feedback|Stakeholder management|Facilitation|Collaboration|Adaptability|Time management|Self-awareness,"Readers will implement belonging cues, run high-candor meetings, and craft purpose phrases that guide daily decisions.",Build safety|Share vulnerability|Establish purpose|Belonging cues|Learning loops,Coyle’s three-skill model; culture playbooks and cueing,"YES: Pixar, SEALs, sports, schools",YES: reflection prompts,Partners|Directors|Managers|Team Members|New Advisors|All Levels,Some team leadership experience,Intermediate,15.0,Apply belonging cues|Facilitate vulnerability loops|Craft purpose phrases|Design onboarding that teaches culture,Introduce check-in rounds|Run AARs|Create ‘cheat sheet’ of norms|Write purpose phrases for workflows,Rebooting team culture|New team formation|Scaling culture,Leaders Eat Last|The 7 Habits|Radical Candor,"""Culture is a set of living relationships working toward a shared goal.""|""Belonging cues are small but mighty.""",,,4.3
006,How to Be a Great Boss,Gino Wickman; René Boer,2016,006_great_boss_wickman_boer.jpg,"Straightforward guide to managing people using EOS-flavored tools—expectations, feedback, and accountability.","Problem: managers lack a simple playbook for leading. Approach: two disciplines (Manage and Lead) + five leadership practices + five management practices. Themes: clarity, scorecards, meetings, people decisions. Audience: line managers and supervisors. Unique value: concise, tool-centric handbook.",All Levels,6,Leadership & Management,Coaching & Mentoring|Communication Skills|Performance Management,Performance management|Expectation setting|Scorecards|Meeting rhythms|One-on-ones|Delegation|Feedback|Talent assessment|Hiring and firing|Coaching,Strategic thinking|Results orientation|People leadership|Change leadership|Decision quality|Communication|Coaching mindset|Accountability,Scorecard setup|Check-ins|Quarterly conversations|People Analyzer|Delegation tools,Active listening|Empathy|Assertiveness|Constructive feedback|Stakeholder management|Facilitation|Collaboration|Adaptability|Time management|Self-awareness,"Managers move from ad hoc supervision to consistent expectations, feedback, and measurement.",Manage vs Lead|Five leadership practices|Five management practices|Quarterly conversations|People Analyzer,EOS People Analyzer|Scorecard & L10 cadence,YES: small-business scenarios,"YES: checklists, worksheets",Partners|Directors|Managers|Team Members|New Advisors|All Levels,Basic supervisory experience,Beginner,9.0,Define role expectations|Run effective 1:1s|Use a scorecard|Coach underperformance|Make people decisions quickly,Adopt quarterly conversations|Build a 5–15 KPI scorecard|Apply People Analyzer|Use IDS for people issues,New managers|Building a management cadence|Turning around drift,Traction|Radical Candor|The First 90 Days,"""Clarity and consistency are gifts bosses give their teams.""|""What gets measured gets managed—by someone.""",,,4.2
007,The Power of Discipline,Daniel Walter,2020,007_power_of_discipline_walter.jpg,Self-control toolkit to achieve long-term goals by mastering impulses and building routines.,"Problem: distractions and short-term gratification derail goals. Approach: cognitive-behavioral techniques, habit design, and willpower training. Themes: commitment, environment design, focus. Audience: professionals seeking personal effectiveness. Unique: plain-language tactics and exercises.",All Levels,7,Personal Development,Decision Making|Emotional Intelligence|Productivity,Self-regulation|Goal setting|Impulse control|Habit tracking|Focus management|Procrastination control|Mindset reframing|Environment design|Resilience|Motivation,Strategic thinking|Results orientation|People leadership|Change leadership|Decision quality|Communication|Coaching mindset|Accountability,Habit trackers|Implementation intentions|Temptation bundling|Distraction audits,Active listening|Empathy|Assertiveness|Constructive feedback|Stakeholder management|Facilitation|Collaboration|Adaptability|Time management|Self-awareness,"Readers establish routines, remove friction for good habits, and maintain momentum toward goals.",Commitment devices|Identity-based habits|Implementation intentions|Keystone routines,CBT strategies for self-control; habit rituals,NO,YES: worksheets and prompts,Partners|Directors|Managers|Team Members|New Advisors|All Levels,None,Beginner,10.5,Diagnose self-sabotage triggers|Design commitment devices|Build a weekly routine|Measure progress,Create an implementation-intention template|Daily habit tracker|Distraction audit|Temptation bundling plan,Regaining focus|Personal productivity reset|Goal execution,Atomic Habits|The 7 Habits|Think and Grow Rich,"""Discipline is choosing what you want most over what you want now.""|""Small routines compound into big results.""",,,4.0
008,The Motive,Patrick Lencioni,2020,008_the_motive_lencioni.jpg,A leadership fable challenging motives—are you a reward-centered leader or a responsibility-centered one?,"Problem: leaders avoid uncomfortable duties, harming organizations. Approach: a fable plus model outlining five responsibilities leaders cannot delegate. Themes: responsibility, meetings, performance management. Audience: senior leaders. Unique: provocative reframing of why to lead.",All Levels,6,Leadership & Management,Coaching & Mentoring|Team Building|Emotional Intelligence,Leadership ethos|Accountability|Performance conversations|Meeting stewardship|Strategy clarity|Hiring the right team|Communication discipline|Courage,Strategic thinking|Results orientation|People leadership|Change leadership|Decision quality|Communication|Coaching mindset|Accountability,Senior team alignment|Role modeling|Cadence of meetings|Performance management system,Active listening|Empathy|Assertiveness|Constructive feedback|Stakeholder management|Facilitation|Collaboration|Adaptability|Time management|Self-awareness,"Leaders accept the hard, often avoided responsibilities and raise standards across the org.",Reward vs Responsibility-centered leadership|Five omissions|Healthy meetings|Cascading communication,The Motive model; leadership responsibilities,YES: leadership fable context,NO,Partners|Directors|Managers|All Levels,Experience leading teams,Intermediate,9.0,Assess leadership motive|Commit to unavoidable responsibilities|Upgrade meeting design|Hold leaders accountable,Cascading comms checklist|Quarterly performance conversations|Leader time audit|Clarify team’s purpose,Resetting executive team norms|New promotion to senior role,The Advantage|Radical Candor|Good to Great,"""The primary reward for leadership is service, not privilege.""|""Leaders must do the things only leaders can do.""",,,4.2
009,The Mountain Is You,Brianna Wiest,2020,009_mountain_is_you_wiest.jpg,Explores self-sabotage and how to transform it into self-mastery through awareness and healing patterns.,"Problem: recurring self-limiting behaviors undermine goals. Approach: blend psychology and practical reflection to identify patterns and rewire responses. Themes: shadow work, emotional processing, identity shift. Audience: professionals seeking personal growth. Unique: compassionate, actionable self-work.",All Levels,8,Personal Development,Emotional Intelligence|Resilience|Mindset,Self-awareness|Emotional regulation|Cognitive reframing|Identity shift|Boundaries|Resilience|Mindfulness|Goal alignment|Habits|Self-coaching,Strategic thinking|Results orientation|People leadership|Change leadership|Decision quality|Communication|Coaching mindset|Accountability,Journaling prompts|Trigger mapping|Reframing scripts|Boundary setting,Active listening|Empathy|Assertiveness|Constructive feedback|Stakeholder management|Facilitation|Collaboration|Adaptability|Time management|Self-awareness,"Readers will notice sabotage loops earlier, process emotions, and choose higher‑value responses.",Self-sabotage mechanics|Identity and habits|Emotional processing|Boundaries|Self-trust,Self-mastery practices; reflection structures,NO,YES: journaling exercises,Partners|Directors|Managers|Team Members|New Advisors|All Levels,None,Beginner,12.0,Identify sabotage patterns|Practice emotion labeling|Reframe limiting beliefs|Design supportive routines,Daily check-in ritual|If-then coping plans|Boundary script templates|Weekly review questions,Burnout recovery|Career transitions|Confidence rebuild,Atomic Habits|The Power of Discipline|The 7 Habits,"""Your new life will cost you your old one.""|""Self-sabotage is a coping mechanism that has outlived its usefulness.""",,,4.1
010,The Mind Manual,Dr Alex George,2022,010_mind_manual_george.jpg,"A practical handbook for mental fitness—tools for stress, sleep, anxiety and mood.","Problem: chronic stress and poor mental hygiene reduce performance. Approach: evidence-informed practices across sleep, movement, nutrition, and thought patterns. Themes: small daily tools, stigma-free language. Audience: all professionals. Unique: accessible clinical insight from a medical doctor.",All Levels,9,Personal Development,Emotional Intelligence|Resilience|Wellbeing,Stress management|Sleep hygiene|Coping strategies|Mindfulness|Self‑care planning|Energy management|Resilience|Focus routines|Digital hygiene|Burnout prevention,Strategic thinking|Results orientation|People leadership|Change leadership|Decision quality|Communication|Coaching mindset|Accountability,Breathing techniques|Sleep routines|Activity scheduling|Thought records,Active listening|Empathy|Assertiveness|Constructive feedback|Stakeholder management|Facilitation|Collaboration|Adaptability|Time management|Self-awareness,"Readers adopt daily mental-fitness rituals, improving focus, mood and energy resilience.",Mental fitness pillars|Sleep/mood link|Coping toolset|When to seek help,Mental fitness toolkit,NO,"YES: exercises, checklists",Partners|Directors|Managers|Team Members|New Advisors|All Levels,None,Beginner,13.5,Assess stressors|Adopt a sleep routine|Use immediate de‑stress tools|Create a weekly mental-fitness plan,Box breathing card|Digital sunset routine|Thought record template|Daily energy check,High workload periods|Busy season resilience|Return from burnout,The 7 Habits|Leaders Eat Last|10% Happier,"""Mental fitness is a practice, not a destination.""|""Small daily tools compound.""",,,4.1
011,Atomic Habits,James Clear,2018,011_atomic_habits_clear.jpg,"Playbook for building good habits and breaking bad ones using small, consistent improvements.","Problem: change efforts fail because they’re too big and unsystematic. Approach: four laws of behavior change with environment design and identity-based habits. Themes: systems over goals, compounding. Audience: all levels. Unique: simple, research-backed framework and rich examples.",All Levels,10,Personal Development,Decision Making|Productivity|Emotional Intelligence,Habit formation|Behavior design|Cue management|Environment design|Identity-based change|Measurement|Feedback loops|Mindset|Goal translation|Execution discipline|Continuous improvement|Focus,Strategic thinking|Results orientation|People leadership|Change leadership|Decision quality|Communication|Coaching mindset|Accountability,Habit tracking|Habit stacking|Cue/Craving/Response/Reward mapping|Environment redesign,Active listening|Empathy|Assertiveness|Constructive feedback|Stakeholder management|Facilitation|Collaboration|Adaptability|Time management|Self-awareness,"Readers install small, reliable routines that compound into outsized results; relapse is managed with system fixes, not willpower.",Tiny gains compound|Identity-based habits|Make it obvious/attractive/easy/satisfying|System vs goal,Four Laws of Behavior Change|Habit Scorecard|Implementation intentions|Habit stacking,YES: multiple cross-industry vignettes,YES: exercises and trackers,Partners|Directors|Managers|Team Members|New Advisors|All Levels,None,Beginner,15.0,Design a habit using the four laws|Break a bad habit by reversing the laws|Measure progress|Build an environment that supports change,Create a habit scorecard|Use habit stacking|Add friction to bad habits|Two-minute rule|Design a habit tracker,Personal productivity|Embedding new managerial behaviors|Client follow‑through systems,The 7 Habits|The Power of Discipline|Think and Grow Rich,"""You do not rise to the level of your goals, you fall to the level of your systems.""|""Every action is a vote for the type of person you wish to become.""",,,4.4
012,The 7 Habits of Highly Effective People,Stephen R. Covey,1989,012_7_habits_covey.jpg,Classic framework of character ethics and timeless habits for personal and interpersonal effectiveness.,"Problem: effectiveness is fragmented without principles. Approach: seven habits moving from dependence to independence to interdependence. Themes: proactivity, priorities, win‑win, empathy, synergy, renewal. Audience: all professionals. Unique: holistic, principle‑centered methodology.",All Levels,13,Personal Development,Leadership & Management|Decision Making|Communication Skills,Proactivity|Prioritization|Time management|Win‑Win negotiation|Empathic listening|Influence|Synergy|Sharpen the saw|Habit building|Self‑leadership,Strategic thinking|Results orientation|People leadership|Change leadership|Decision quality|Communication|Coaching mindset|Accountability,Time management matrix|Personal mission|Weekly planning|Role goals,Active listening|Empathy|Assertiveness|Constructive feedback|Stakeholder management|Facilitation|Collaboration|Adaptability|Time management|Self-awareness,"Readers align life around principles, manage priorities, and improve relationships with empathic communication.",Private victory then public victory|Habit 1‑7|Quadrant II time|Emotional bank account,Covey’s 7‑Habits model|Time Matrix|Circle of Influence/Concern,YES: business & personal examples,YES: reflection tasks,Partners|Directors|Managers|Team Members|New Advisors|All Levels,None,Beginner,19.5,Apply the Time Matrix|Practice empathic listening|Define a personal mission|Seek Win‑Win agreements,Weekly roles & goals review|Q2 planning routine|Listening ladder practice|Win‑Win negotiation prep,Career foundations|Leadership fundamentals|Work–life effectiveness,Atomic Habits|How to Win Friends|The First 90 Days,"""Seek first to understand, then to be understood.""|""The main thing is to keep the main thing the main thing.""",,,4.2
